Geeky, nerdy, scientific, perverted feminist atheist who recently escaped Indiana for Seattle.
I would not consider myself as complete Atheist, because I still believe in some form of God.
For all the reasons you give as a motivator for atheist violence, I can add religion on top.
Obama was born an atheist, just like every other baby that is born.
As an atheist, I could live in a country free of religion.
I'm an Atheist and every day I see things that confirm my views.
As you profess to be an atheist, I was curious about your point of view.
I was relieved to know I wasn't the only atheist on my campus.
When I appeared or spoke at atheist events, there was always a flood of comments about my chest and appearance.
I just don't want to be part of the atheist movement now.